{"$schema":"https://json-schema.org/draft/2020-12/schema","$id":"https://enterprise-agent-system.invalid/profiles/agent-thinking-inception/contracts/inception-contract-bundle.v1.schema.json","title":"Agent Thinking Inception detailed contract bundle v1","type":"object","additionalProperties":false,"required":["schema_version","bundle_id","profile_id","source_subject_id","source_digest","records","claims_not_proven","bundle_digest"],"properties":{"schema_version":{"const":"enterprise-agent-system/inception-contract-bundle/v1"},"bundle_id":{"type":"string","pattern":"^BUNDLE-"},"profile_id":{"const":"PROFILE-AGENT-THINKING-INCEPTION-001"},"source_subject_id":{"const":"SRC-PDF-INCEPTION-001"},"source_digest":{"type":"string","pattern":"^sha256:[0-9a-f]{64}$"},"records":{"type":"array","minItems":11,"maxItems":11,"items":{"oneOf":[{"$ref":"#/$defs/context_budget_policy"},{"$ref":"#/$defs/safe_tool_transaction"},{"$ref":"#/$defs/compaction_request"},{"$ref":"#/$defs/compaction_checkpoint_binding"},{"$ref":"#/$defs/steering_capability_requirement"},{"$ref":"#/$defs/code_evidence_requirement"},{"$ref":"#/$defs/citation_claim_requirement"},{"$ref":"#/$defs/four_tier_provenance_requirement"},{"$ref":"#/$defs/ingress_writeback_requirement"},{"$ref":"#/$defs/profile_owner_binding"},{"$ref":"#/$defs/profile_closure_record"}]}},"claims_not_proven":{"type":"array","minItems":1,"uniqueItems":true,"items":{"type":"string","minLength":1}},"bundle_digest":{"type":"string","pattern":"^sha256:[0-9a-f]{64}$"}},"$defs":{"context_budget_policy":{"type":"object","additionalProperties":false,"required":["schema_version","policy_id","provider_id","model_id","tokenizer_id","advertised_context_tokens","reserve_tokens","soft_checkpoint_ratio","hard_stop_ratio","measured_tokens","active_transaction_id","state","owner","claims_not_proven"],"properties":{"schema_version":{"const":"enterprise-agent-system/context-budget-policy/v1"},"policy_id":{},"provider_id":{},"model_id":{},"tokenizer_id":{},"advertised_context_tokens":{},"reserve_tokens":{},"soft_checkpoint_ratio":{},"hard_stop_ratio":{},"measured_tokens":{},"active_transaction_id":{},"state":{},"owner":{},"claims_not_proven":{}}},"safe_tool_transaction":{"type":"object","additionalProperties":false,"required":["schema_version","transaction_id","task_id","assistant_message_id","tool_calls","tool_results","safe_boundary","state","owner","claims_not_proven"],"properties":{"schema_version":{"const":"enterprise-agent-system/safe-tool-transaction/v1"},"transaction_id":{},"task_id":{},"assistant_message_id":{},"tool_calls":{},"tool_results":{},"safe_boundary":{},"state":{},"owner":{},"claims_not_proven":{}}},"compaction_request":{"type":"object","additionalProperties":false,"required":["schema_version","request_id","task_id","policy_id","expected_state_version","trigger","old_context_digest","candidate_checkpoint_id","requested_at","state","owner","claims_not_proven"],"properties":{"schema_version":{"const":"enterprise-agent-system/compaction-request/v1"},"request_id":{},"task_id":{},"policy_id":{},"expected_state_version":{},"trigger":{},"old_context_digest":{},"candidate_checkpoint_id":{},"requested_at":{},"state":{},"owner":{},"claims_not_proven":{}}},"compaction_checkpoint_binding":{"type":"object","additionalProperties":false,"required":["schema_version","checkpoint_id","request_id","task_id","attempt_id","state_version_before","state_version_after","prior_context_digest","new_context_digest","artifact_manifest_digest","unresolved_work_digest","capability_leases_digest","pending_effects_digest","policy_epoch","rollback","activation_state","recovery_probe","owner","claims_not_proven"],"properties":{"schema_version":{"const":"enterprise-agent-system/compaction-checkpoint-binding/v1"},"checkpoint_id":{},"request_id":{},"task_id":{},"attempt_id":{},"state_version_before":{},"state_version_after":{},"prior_context_digest":{},"new_context_digest":{},"artifact_manifest_digest":{},"unresolved_work_digest":{},"capability_leases_digest":{},"pending_effects_digest":{},"policy_epoch":{},"rollback":{},"activation_state":{},"recovery_probe":{},"owner":{},"claims_not_proven":{}}},"steering_capability_requirement":{"type":"object","additionalProperties":false,"required":["schema_version","requirement_id","provider_id","model_id","capabilities","allowed_actions","observation_receipt","state","owner","claims_not_proven"],"properties":{"schema_version":{"const":"enterprise-agent-system/steering-capability-requirement/v1"},"requirement_id":{},"provider_id":{},"model_id":{},"capabilities":{},"allowed_actions":{},"observation_receipt":{},"state":{},"owner":{},"claims_not_proven":{}}},"code_evidence_requirement":{"type":"object","additionalProperties":false,"required":["schema_version","evidence_id","claim_id","repository","commit","tree","normalized_path","line_start","line_end","snippet_digest","symbol","parser","source_readback_digest","state","owner","claims_not_proven"],"properties":{"schema_version":{"const":"enterprise-agent-system/code-evidence-requirement/v1"},"evidence_id":{},"claim_id":{},"repository":{},"commit":{},"tree":{},"normalized_path":{},"line_start":{},"line_end":{},"snippet_digest":{},"symbol":{},"parser":{},"source_readback_digest":{},"state":{},"owner":{},"claims_not_proven":{}}},"citation_claim_requirement":{"type":"object","additionalProperties":false,"required":["schema_version","claim_id","source_subject_id","source_digest","locator","exact_quote_digest","authority_class","deterministic_gate","semantic_review","final_state","owner","claims_not_proven"],"properties":{"schema_version":{"const":"enterprise-agent-system/citation-claim-requirement/v1"},"claim_id":{},"source_subject_id":{},"source_digest":{},"locator":{},"exact_quote_digest":{},"authority_class":{},"deterministic_gate":{},"semantic_review":{},"final_state":{},"owner":{},"claims_not_proven":{}}},"four_tier_provenance_requirement":{"type":"object","additionalProperties":false,"required":["schema_version","provenance_id","dimensions","data_flow_digest","review_expiry","state","owner","claims_not_proven"],"properties":{"schema_version":{"const":"enterprise-agent-system/four-tier-provenance-requirement/v1"},"provenance_id":{},"dimensions":{},"data_flow_digest":{},"review_expiry":{},"state":{},"owner":{},"claims_not_proven":{}}},"ingress_writeback_requirement":{"type":"object","additionalProperties":false,"required":["schema_version","binding_id","provider","event_identity","authenticity","dedupe_key","inbox","task_admission","write_intent","effect_ledger","remote_readback","compensation","final_state","owner","claims_not_proven"],"properties":{"schema_version":{"const":"enterprise-agent-system/ingress-writeback-requirement/v1"},"binding_id":{},"provider":{},"event_identity":{},"authenticity":{},"dedupe_key":{},"inbox":{},"task_admission":{},"write_intent":{},"effect_ledger":{},"remote_readback":{},"compensation":{},"final_state":{},"owner":{},"claims_not_proven":{}}},"profile_owner_binding":{"type":"object","additionalProperties":false,"required":["schema_version","binding_id","profile_id","interfaces","consumers","state","claims_not_proven"],"properties":{"schema_version":{"const":"enterprise-agent-system/profile-owner-binding/v1"},"binding_id":{},"profile_id":{},"interfaces":{},"consumers":{},"state":{},"claims_not_proven":{}}},"profile_closure_record":{"type":"object","additionalProperties":false,"required":["schema_version","closure_id","profile_id","source_digest","requirements_total","contradictions_total","evidence","blockers","next_transition","human_owned","closure_state","claims_not_proven"],"properties":{"schema_version":{"const":"enterprise-agent-system/profile-closure-record/v1"},"closure_id":{},"profile_id":{},"source_digest":{},"requirements_total":{},"contradictions_total":{},"evidence":{},"blockers":{},"next_transition":{},"human_owned":{},"closure_state":{},"claims_not_proven":{}}}}}