{"schema_version":"enterprise-agent-system/inception-contract-bundle/v1","bundle_id":"BUNDLE-INCEPTION-C1-001","profile_id":"PROFILE-AGENT-THINKING-INCEPTION-001","source_subject_id":"SRC-PDF-INCEPTION-001","source_digest":"sha256:a6f1245ff865cae24838ed8ec4828330be684f3c03b29b9064ade8bfac94d8da","records":[{"schema_version":"enterprise-agent-system/context-budget-policy/v1","policy_id":"CTX-POLICY-INCEPTION-001","provider_id":"provider-unbound","model_id":"model-unbound","tokenizer_id":"tokenizer-unbound","advertised_context_tokens":131072,"reserve_tokens":8192,"soft_checkpoint_ratio":0.75,"hard_stop_ratio":0.8,"measured_tokens":0,"active_transaction_id":null,"state":"BOUND","owner":{"repository":"ed3c/runtime-env","directory":"contracts/context-budget","issue":"https://github.com/ed3c/enterprise_agent_system/issues/7"},"claims_not_proven":["Provider/model/tokenizer runtime capability has not been observed.","The 75% and 80% ratios are policy candidates, not universal constants."]},{"schema_version":"enterprise-agent-system/safe-tool-transaction/v1","transaction_id":"TOOL-TXN-INCEPTION-001","task_id":"TASK-INCEPTION-COMPACTION","assistant_message_id":"MSG-ASSISTANT-001","tool_calls":[{"call_id":"CALL-001","tool_name":"write_checkpoint","ordinal":0},{"call_id":"CALL-002","tool_name":"verify_checkpoint","ordinal":1}],"tool_results":[{"call_id":"CALL-001","ordinal":0,"state":"PASS"},{"call_id":"CALL-002","ordinal":1,"state":"PASS"}],"safe_boundary":"AFTER_ALL_RESULTS","state":"COMPLETE","owner":{"repository":"ed3c/bettor-arena","directory":"src/state/transactions","issue":"https://github.com/ed3c/enterprise_agent_system/issues/5"},"claims_not_proven":["No live provider tool-call sequence has been exercised."]},{"schema_version":"enterprise-agent-system/compaction-request/v1","request_id":"COMPACT-REQ-INCEPTION-001","task_id":"TASK-INCEPTION-COMPACTION","policy_id":"CTX-POLICY-INCEPTION-001","expected_state_version":7,"trigger":{"measured_tokens":98304,"advertised_context_tokens":131072,"usage_ratio":0.75,"active_transaction_state":"SAFE"},"old_context_digest":"sha256:1111111111111111111111111111111111111111111111111111111111111111","candidate_checkpoint_id":"CHECKPOINT-INCEPTION-008","requested_at":"2026-08-18T14:45:00Z","state":"ADMITTED","owner":{"repository":"ed3c/bettor-arena","directory":"src/context/compaction","issue":"https://github.com/ed3c/enterprise_agent_system/issues/5"},"claims_not_proven":["The request has not been executed against a live model context."]},{"schema_version":"enterprise-agent-system/compaction-checkpoint-binding/v1","checkpoint_id":"CHECKPOINT-INCEPTION-008","request_id":"COMPACT-REQ-INCEPTION-001","task_id":"TASK-INCEPTION-COMPACTION","attempt_id":"ATTEMPT-COMPACTION-008","state_version_before":7,"state_version_after":8,"prior_context_digest":"sha256:1111111111111111111111111111111111111111111111111111111111111111","new_context_digest":"sha256:2222222222222222222222222222222222222222222222222222222222222222","artifact_manifest_digest":"sha256:3333333333333333333333333333333333333333333333333333333333333333","unresolved_work_digest":"sha256:4444444444444444444444444444444444444444444444444444444444444444","capability_leases_digest":"sha256:5555555555555555555555555555555555555555555555555555555555555555","pending_effects_digest":"sha256:6666666666666666666666666666666666666666666666666666666666666666","policy_epoch":"POLICY-EPOCH-001","rollback":{"checkpoint_id":"CHECKPOINT-INCEPTION-007","digest":"sha256:7777777777777777777777777777777777777777777777777777777777777777"},"activation_state":"ACTIVATED","recovery_probe":{"state":"PASS","receipt_digest":"sha256:8888888888888888888888888888888888888888888888888888888888888888"},"owner":{"repository":"ed3c/bettor-arena","directory":"src/state/checkpoints","issue":"https://github.com/ed3c/enterprise_agent_system/issues/5"},"claims_not_proven":["Durable storage crash recovery and concurrent activation have not been physically exercised."]},{"schema_version":"enterprise-agent-system/steering-capability-requirement/v1","requirement_id":"STEERING-INCEPTION-001","provider_id":"provider-unbound","model_id":"model-unbound","capabilities":{"streaming_visibility":"UNKNOWN","safe_sync_point":"UNKNOWN","cancellation":"UNKNOWN","resume":"UNKNOWN","assistant_prefill":"UNKNOWN","hidden_reasoning_access":"UNSUPPORTED"},"allowed_actions":["CHECKPOINT","TOOL_REQUEST","NO_ACTION","HUMAN_ESCALATE"],"observation_receipt":null,"state":"CAPABILITY_UNBOUND","owner":{"repository":"ed3c/agent-shield-monorepo","directory":"runtime/providers","issue":"https://github.com/ed3c/enterprise_agent_system/issues/7"},"claims_not_proven":["No provider capability is inferred from model output or documentation prose."]},{"schema_version":"enterprise-agent-system/code-evidence-requirement/v1","evidence_id":"CODE-EVIDENCE-INCEPTION-001","claim_id":"CLAIM-INCEPTION-001","repository":"ed3c/enterprise_agent_system","commit":"1f0d196c19b7fa4505894ff1fb8b27cd33c5fb9f","tree":"924967e5fb51dad8ad09e321109063d4f7b2ec70","normalized_path":"profiles/agent-thinking-inception/tests/verify_profile.py","line_start":1,"line_end":20,"snippet_digest":"sha256:9999999999999999999999999999999999999999999999999999999999999999","symbol":{"name":"validate_bundle","kind":"FUNCTION","signature_digest":"sha256:aaaaaaaaaaaaaaaaaaaaaaaaaaaaaaaaaaaaaaaaaaaaaaaaaaaaaaaaaaaaaaaa"},"parser":{"name":"python-ast","version":"3.12","grammar":"python"},"source_readback_digest":"sha256:bbbbbbbbbbbbbbbbbbbbbbbbbbbbbbbbbbbbbbbbbbbbbbbbbbbbbbbbbbbbbbbb","state":"CANDIDATE","owner":{"repository":"ed3c/truth-verify-loop","directory":"verification/code","issue":"https://github.com/ed3c/enterprise_agent_system/issues/15"},"claims_not_proven":["The placeholder snippet and signature digests are contract fixtures, not verified code evidence."]},{"schema_version":"enterprise-agent-system/citation-claim-requirement/v1","claim_id":"CLAIM-INCEPTION-001","source_subject_id":"SRC-PDF-INCEPTION-001","source_digest":"sha256:a6f1245ff865cae24838ed8ec4828330be684f3c03b29b9064ade8bfac94d8da","locator":{"kind":"PAGE_LINES","start":5,"end":8},"exact_quote_digest":"sha256:cccccccccccccccccccccccccccccccccccccccccccccccccccccccccccccccc","authority_class":"SOURCE_PROPOSAL","deterministic_gate":{"state":"PASS","receipt_digest":"sha256:dddddddddddddddddddddddddddddddddddddddddddddddddddddddddddddddd"},"semantic_review":{"state":"ABSTAIN","reviewer_type":"MODEL_JUDGE","receipt_digest":null},"final_state":"UNVERIFIABLE","owner":{"repository":"ed3c/truth-verify-loop","directory":"verification/citations","issue":"https://github.com/ed3c/enterprise_agent_system/issues/15"},"claims_not_proven":["Lexical presence does not prove semantic support.","A model judge cannot promote the claim to Human or release truth."]},{"schema_version":"enterprise-agent-system/four-tier-provenance-requirement/v1","provenance_id":"PROVENANCE-INCEPTION-001","dimensions":{"CODE":{"subject_id":"CODE-SUBJECT-001","version":"UNBOUND","terms_digest":null,"policy_state":"UNKNOWN","obligations":["capture exact repository commit tree and dependency SBOM"],"blockers":["exact dependency and notice review absent"],"human_review_required":true},"MODEL":{"subject_id":"MODEL-SUBJECT-001","version":"UNBOUND","terms_digest":null,"policy_state":"UNKNOWN","obligations":["capture exact provider model version and ToS"],"blockers":["distillation and data-use terms unreviewed"],"human_review_required":true},"DATA":{"subject_id":"DATA-SUBJECT-001","version":"UNBOUND","terms_digest":null,"policy_state":"UNKNOWN","obligations":["capture dataset card lineage consent and deletion rules"],"blockers":["dataset source and derivative obligations unreviewed"],"human_review_required":true},"TRACE":{"subject_id":"TRACE-SUBJECT-001","version":"UNBOUND","terms_digest":null,"policy_state":"UNKNOWN","obligations":["sanitize before export and bind retention deletion and RBAC"],"blockers":["collector and exporter route not exercised"],"human_review_required":true}},"data_flow_digest":"sha256:eeeeeeeeeeeeeeeeeeeeeeeeeeeeeeeeeeeeeeeeeeeeeeeeeeeeeeeeeeeeeeee","review_expiry":"2026-11-18T00:00:00Z","state":"HUMAN_REVIEW_REQUIRED","owner":{"repository":"ed3c/enterprise_agent_system","directory":"profiles/agent-thinking-inception/policies/provenance","issue":"https://github.com/ed3c/enterprise_agent_system/issues/16"},"claims_not_proven":["Automated policy checks do not provide legal advice or commercial clearance."]},{"schema_version":"enterprise-agent-system/ingress-writeback-requirement/v1","binding_id":"INGRESS-INCEPTION-001","provider":"GITHUB","event_identity":"EVENT-001","authenticity":{"state":"PASS","receipt_digest":"sha256:ffffffffffffffffffffffffffffffffffffffffffffffffffffffffffffffff"},"dedupe_key":"github:delivery:EVENT-001","inbox":{"state":"PASS","receipt_digest":"sha256:0000000000000000000000000000000000000000000000000000000000000000"},"task_admission":{"state":"PASS","receipt_digest":"sha256:1111111111111111111111111111111111111111111111111111111111111111"},"write_intent":{"effect_id":"EFFECT-001","capability_id":"CAP-GITHUB-COMMENT","expected_remote_version":"ISSUE-V1","payload_digest":"sha256:2222222222222222222222222222222222222222222222222222222222222222"},"effect_ledger":{"state":"RESERVED","receipt_digest":"sha256:3333333333333333333333333333333333333333333333333333333333333333"},"remote_readback":{"state":"NOT_EXERCISED","receipt_digest":null},"compensation":{"state":"NOT_REQUIRED","receipt_digest":null},"final_state":"WRITE_INTENT_PREPARED","owner":{"repository":"ed3c/bettor-arena","directory":"src/effects","issue":"https://github.com/ed3c/enterprise_agent_system/issues/18"},"claims_not_proven":["No external write has been performed.","HTTP acknowledgement is not task or effect completion."]},{"schema_version":"enterprise-agent-system/profile-owner-binding/v1","binding_id":"OWNER-BINDING-INCEPTION-001","profile_id":"PROFILE-AGENT-THINKING-INCEPTION-001","interfaces":[{"interface_id":"ince